{
  "schemaVersion": 1,
  "gameKey": "skull",
  "sceneId": "bid.raise-or-pass",
  "revision": 17,
  "phase": "bidding",
  "rules": {
    "targetWins": 2,
    "lastChanceEnabled": true
  },
  "players": [
    {
      "id": "p1",
      "seat": 0,
      "displayName": "阿岚",
      "status": "active",
      "challengeWins": 0,
      "matSide": "blank",
      "lastChanceUsed": false,
      "passedBid": false,
      "hand": [
        { "id": "p1-f2", "kind": "flower", "origin": "personal", "faceUp": false },
        { "id": "p1-f3", "kind": "flower", "origin": "personal", "faceUp": false }
      ],
      "stack": [
        { "id": "p1-f1", "kind": "flower", "origin": "personal", "faceUp": false },
        { "id": "p1-s1", "kind": "skull", "origin": "personal", "faceUp": false }
      ],
      "removed": []
    },
    {
      "id": "p2",
      "seat": 1,
      "displayName": "白露",
      "status": "active",
      "challengeWins": 1,
      "matSide": "flower",
      "lastChanceUsed": false,
      "passedBid": false,
      "hand": [
        { "id": "p2-f3", "kind": "flower", "origin": "personal", "faceUp": false },
        { "id": "p2-s1", "kind": "skull", "origin": "personal", "faceUp": false }
      ],
      "stack": [
        { "id": "p2-f1", "kind": "flower", "origin": "personal", "faceUp": false },
        { "id": "p2-f2", "kind": "flower", "origin": "personal", "faceUp": false }
      ],
      "removed": []
    },
    {
      "id": "p3",
      "seat": 2,
      "displayName": "赤岩",
      "status": "active",
      "challengeWins": 0,
      "matSide": "blank",
      "lastChanceUsed": false,
      "passedBid": true,
      "hand": [
        { "id": "p3-f1", "kind": "flower", "origin": "personal", "faceUp": false },
        { "id": "p3-f2", "kind": "flower", "origin": "personal", "faceUp": false },
        { "id": "p3-f3", "kind": "flower", "origin": "personal", "faceUp": false }
      ],
      "stack": [
        { "id": "p3-s1", "kind": "skull", "origin": "personal", "faceUp": false }
      ],
      "removed": []
    }
  ],
  "sharedDiscs": [
    {
      "id": "last-chance",
      "kind": "last_chance_flower",
      "origin": "last_chance",
      "faceUp": true
    }
  ],
  "roundState": {
    "number": 1,
    "firstPlayerId": "p1",
    "currentPlayerId": "p1",
    "committedPlayerIds": ["p1", "p2", "p3"],
    "totalPlaced": 5,
    "bid": {
      "currentBid": 3,
      "highBidderId": "p2",
      "passedPlayerIds": ["p3"]
    },
    "challenge": {
      "challengerId": null,
      "targetBid": 0,
      "revealedDiscIds": [],
      "failedDiscId": null,
      "skullOwnerId": null,
      "pendingPenalty": null
    },
    "lastChanceHolderId": null,
    "lastChanceExpiresAfterRound": null,
    "nextFirstPlayerDecisionBy": null
  },
  "result": null
}
