{
  "schemaVersion": 1,
  "gameKey": "skull",
  "sceneId": "round.place-or-bid",
  "revision": 46,
  "phase": "placement",
  "rules": {
    "targetWins": 2,
    "lastChanceEnabled": true
  },
  "players": [
    {
      "id": "p1",
      "seat": 0,
      "displayName": "阿岚",
      "status": "active",
      "challengeWins": 1,
      "matSide": "flower",
      "lastChanceUsed": false,
      "passedBid": false,
      "hand": [
        { "id": "p1-f2", "kind": "flower", "origin": "personal", "faceUp": false },
        { "id": "p1-f3", "kind": "flower", "origin": "personal", "faceUp": false },
        { "id": "p1-s1", "kind": "skull", "origin": "personal", "faceUp": false }
      ],
      "stack": [
        { "id": "p1-f1", "kind": "flower", "origin": "personal", "faceUp": false }
      ],
      "removed": []
    },
    {
      "id": "p2",
      "seat": 1,
      "displayName": "白露",
      "status": "active",
      "challengeWins": 0,
      "matSide": "blank",
      "lastChanceUsed": true,
      "passedBid": false,
      "hand": [
        { "id": "p2-s1", "kind": "skull", "origin": "personal", "faceUp": false }
      ],
      "stack": [
        {
          "id": "last-chance",
          "kind": "last_chance_flower",
          "origin": "last_chance",
          "faceUp": false
        }
      ],
      "removed": [
        { "id": "p2-f1", "kind": "flower", "origin": "personal", "faceUp": false },
        { "id": "p2-f2", "kind": "flower", "origin": "personal", "faceUp": false },
        { "id": "p2-f3", "kind": "flower", "origin": "personal", "faceUp": false }
      ]
    },
    {
      "id": "p3",
      "seat": 2,
      "displayName": "赤岩",
      "status": "active",
      "challengeWins": 0,
      "matSide": "blank",
      "lastChanceUsed": false,
      "passedBid": false,
      "hand": [
        { "id": "p3-f2", "kind": "flower", "origin": "personal", "faceUp": false },
        { "id": "p3-f3", "kind": "flower", "origin": "personal", "faceUp": false },
        { "id": "p3-s1", "kind": "skull", "origin": "personal", "faceUp": false }
      ],
      "stack": [
        { "id": "p3-f1", "kind": "flower", "origin": "personal", "faceUp": false }
      ],
      "removed": []
    }
  ],
  "sharedDiscs": [],
  "roundState": {
    "number": 3,
    "firstPlayerId": "p3",
    "currentPlayerId": "p3",
    "committedPlayerIds": ["p1", "p2", "p3"],
    "totalPlaced": 3,
    "bid": {
      "currentBid": 0,
      "highBidderId": null,
      "passedPlayerIds": []
    },
    "challenge": {
      "challengerId": null,
      "targetBid": 0,
      "revealedDiscIds": [],
      "failedDiscId": null,
      "skullOwnerId": null,
      "pendingPenalty": null
    },
    "lastChanceHolderId": "p2",
    "lastChanceExpiresAfterRound": 3,
    "nextFirstPlayerDecisionBy": null
  },
  "result": null
}
